{
  "_schema": "calendar_event",
  "_id": "3fa85f64-5717-4562-b3fc-2c963f66afa6",
  "_org": "123",
  "_title": "Entity Title",
  "_tags": [
    "family:label"
  ],
  "calendar": {
    "$relation": [
      {
        "entity_id": "123e4567-e89b-12d3-a456-426614174000",
        "_tags": [
          "example"
        ]
      }
    ]
  },
  "subject": "string",
  "description": "string",
  "event_type": "singleInstance",
  "status": "free",
  "start_time": "1970-01-01T00:00:00.000Z",
  "end_time": "1970-01-01T00:00:00.000Z",
  "timezone": "string",
  "is_all_day": true,
  "location": "string",
  "is_cancelled": true,
  "sensitivity": "normal",
  "importance": "low",
  "is_online_meeting": true,
  "online_meeting_url": "string",
  "web_link": "string",
  "response_status": "none",
  "organizer_email": "user@example.com",
  "attendees": "string",
  "is_recurring": true,
  "series_master_id": "string",
  "source_type": "native",
  "source_provider": "outlook",
  "provider_event_id": "string",
  "provider_event_url": "string",
  "etag": "string",
  "last_synced_at": "1970-01-01T00:00:00.000Z",
  "_files": {
    "$relation": [
      {
        "entity_id": "123e4567-e89b-12d3-a456-426614174000",
        "_tags": [
          "example"
        ]
      }
    ]
  },
  "_created_at": "1970-01-01T00:00:00.000Z",
  "_updated_at": "1970-01-01T00:00:00.000Z",
  "_owners": [
    {
      "org_id": "123",
      "user_id": "456"
    }
  ],
  "_acl": {
    "view": [
      "org:456"
    ],
    "edit": [
      "org:456"
    ],
    "delete": [
      "org:456"
    ]
  },
  "_manifest": [
    "123e4567-e89b-12d3-a456-426614174000"
  ]
}